{
  "schema_version": "1.0.0",
  "artifact_scope": "indicator_scoring_requirements",
  "requirements_version": "pose-wave-indicator-requirements-2026-10-01.2",
  "source": {
    "kind": "versioned_registry_and_manual_truth_contract",
    "registry_version": "pose-wave-2026-10-01.2",
    "registry_content_sha256": "013ebb92b90ddce24f98c1b7f89dbc0afec76bf92cbd88ebd745bd59ca64d4e6",
    "semantic_contract_version": "scoring-truth-pack-v0.3.0",
    "semantic_contract_sha256": "1cce0993e207c64a54c21c816dbc32b3b66c054dc694a31f3c27759a999a601e",
    "canonicalization": "rallymate-canonical-json-v1"
  },
  "indicators": [
    {
      "indicator_id": "FS01-M02",
      "required_feature_names": [
        "hip_center_y_body",
        "left_knee_flexion_deg",
        "right_knee_flexion_deg",
        "stance_width_body",
        "hip_center_relative_to_ankle_support"
      ],
      "required_phase_keys": [
        "preload_ms"
      ],
      "required_semantic_keys": [],
      "registry_indicator_sha256": "594114eb45209dfb83a2ddb67224774f2866bf2ca0b91df627358e68d349c2e9"
    },
    {
      "indicator_id": "FS01-M03",
      "required_feature_names": [
        "bilateral_foot_rise_min_body",
        "bilateral_foot_rise_synchrony_ms",
        "bilateral_foot_rise_proxy_duration_ms",
        "hip_center_vertical_velocity_body_s"
      ],
      "required_phase_keys": [
        "takeoff_proxy_ms"
      ],
      "required_semantic_keys": [
        "bilateral_foot_contact_state"
      ],
      "registry_indicator_sha256": "d321e91f9d7086f03e9347a904379203cbcc8777d0852c29edbd501a851fc6cf"
    },
    {
      "indicator_id": "FS01-M04",
      "required_feature_names": [
        "bilateral_foot_vertical_slowdown_time_offset_ms",
        "post_slowdown_stance_width_body",
        "hip_center_lateral_variability_body"
      ],
      "required_phase_keys": [
        "landing_proxy_ms"
      ],
      "required_semantic_keys": [
        "left_foot_contact_or_settle",
        "post_landing_stable_interval",
        "right_foot_contact_or_settle"
      ],
      "registry_indicator_sha256": "f5a3ff7a58981c125e0d46f95a1773939669f7dbeeb6e9902843472817982a39"
    },
    {
      "indicator_id": "FS01-M05",
      "required_feature_names": [
        "body_center_speed_body_s",
        "hip_center_relative_to_ankle_support",
        "torso_lean_deg",
        "shoulder_hip_angular_velocity"
      ],
      "required_phase_keys": [
        "initiation_ms",
        "redistribution_ms"
      ],
      "required_semantic_keys": [],
      "registry_indicator_sha256": "70c8b24d35a36650e7348173b493ee5c86b9e029af29f11a2454d3161e46ddf6"
    },
    {
      "indicator_id": "FS02-M02",
      "required_feature_names": [
        "body_center_speed_body_s",
        "hip_center_relative_to_ankle_support",
        "torso_lean_deg",
        "launch_direction_deg",
        "target_direction_alignment_error_deg"
      ],
      "required_phase_keys": [
        "direction_conversion_ms"
      ],
      "required_semantic_keys": [
        "target_direction"
      ],
      "registry_indicator_sha256": "80af9d453697594edf2a7cbc60c5a82aeb7911d20c1664fba60b6718cd226ccc"
    },
    {
      "indicator_id": "FS02-M03",
      "required_feature_names": [
        "launch_direction_deg",
        "drive_side_code",
        "support_knee_extension_velocity_deg_s",
        "hip_acceleration_along_launch_direction_body_s2",
        "support_drive_to_moving_foot_rise_proxy_ms"
      ],
      "required_phase_keys": [
        "lead_foot_motion_onset_proxy_ms",
        "support_extension_proxy_ms"
      ],
      "required_semantic_keys": [
        "support_side"
      ],
      "registry_indicator_sha256": "707ecbb5f0649cb96d7a47742ce70c3f21fb5e6b2b8212cde5657b9c6a20906b"
    },
    {
      "indicator_id": "FS02-M04",
      "required_feature_names": [
        "launch_direction_deg",
        "launch_side_code",
        "launch_foot_speed_peak_body_s",
        "launch_foot_relative_displacement_body",
        "launch_foot_motion_duration_ms"
      ],
      "required_phase_keys": [
        "lead_foot_motion_onset_proxy_ms"
      ],
      "required_semantic_keys": [
        "launch_foot_contact_state",
        "launch_side"
      ],
      "registry_indicator_sha256": "9b744eb6d080ded911790c54cab6fd12882031886f91db84bdd259c90a1ae043"
    },
    {
      "indicator_id": "FS02-M05",
      "required_feature_names": [
        "launch_side_code",
        "launch_foot_speed_drop_body_s",
        "first_step_displacement_body",
        "post_step_hip_direction_consistency",
        "launch_foot_slowdown_to_post_hip_direction_ms",
        "post_step_stance_width_body"
      ],
      "required_phase_keys": [
        "first_step_slowdown_proxy_ms"
      ],
      "required_semantic_keys": [
        "first_step_contact_or_settle",
        "launch_side",
        "post_step_direction_interval"
      ],
      "registry_indicator_sha256": "490c8b86d5f14b156d9713e94474b5c13b2f4d9ba4bccf33a0dee23c0a04acc4"
    },
    {
      "indicator_id": "FS09-M01",
      "required_feature_names": [
        "hip_center_speed_body_s",
        "hip_center_motion_direction_deg",
        "hip_center_relative_to_ankle_midpoint_x_body",
        "hip_center_relative_to_ankle_midpoint_y_body",
        "hip_center_speed_trend_body_s2"
      ],
      "required_phase_keys": [],
      "required_semantic_keys": [
        "camera_motion_audit",
        "inertia_direction"
      ],
      "registry_indicator_sha256": "3ce4062ff75d10e8b9532c969b683225257c8b66730f3517a815309469c967ba"
    },
    {
      "indicator_id": "FS09-M02",
      "required_feature_names": [
        "left_ankle_speed_body_s",
        "right_ankle_speed_body_s",
        "left_ankle_speed_drop_body_s",
        "right_ankle_speed_drop_body_s",
        "braking_side_code",
        "braking_ankle_speed_drop_body_s",
        "left_knee_flexion_change_deg",
        "right_knee_flexion_change_deg",
        "hip_center_deceleration_body_s2",
        "braking_ankle_slowdown_to_hip_deceleration_ms"
      ],
      "required_phase_keys": [],
      "required_semantic_keys": [
        "braking_foot_touchdown",
        "braking_side"
      ],
      "registry_indicator_sha256": "e802fa2566dc5dcf92178f2f1335b2426b761de9a6e17bd2ec7bc8eb18887462"
    },
    {
      "indicator_id": "FS09-M03",
      "required_feature_names": [
        "hip_center_deceleration_body_s2",
        "hip_center_speed_drop_body_s",
        "left_knee_flexion_change_deg",
        "right_knee_flexion_change_deg",
        "hip_height_delta_body",
        "torso_lean_variability_deg"
      ],
      "required_phase_keys": [
        "deceleration_peak_ms",
        "peak_speed_ms"
      ],
      "required_semantic_keys": [],
      "registry_indicator_sha256": "554d1d42506ea3890cab9e39e1d532c08e6f53301f183b3c3f7496e57cf8fd74"
    },
    {
      "indicator_id": "FS09-M04",
      "required_feature_names": [
        "hip_center_relative_to_ankle_support",
        "hip_center_relative_to_ankle_midpoint_x_body",
        "hip_center_relative_to_ankle_midpoint_y_body",
        "hip_center_speed_drop_body_s",
        "stance_width_body",
        "stability_duration_ms",
        "shoulder_hip_angular_velocity_change_deg_s",
        "double_support_proxy_duration_ms"
      ],
      "required_phase_keys": [
        "restabilization_onset_ms"
      ],
      "required_semantic_keys": [
        "stable_interval"
      ],
      "registry_indicator_sha256": "4f674e54d95284c40ed99b189679644dee5a0c9f709128d389020996149b1d62"
    },
    {
      "indicator_id": "FS09-M05",
      "required_feature_names": [
        "stability_duration_ms",
        "hip_center_speed_drop_body_s",
        "double_support_proxy_duration_ms",
        "torso_lean_variability_deg",
        "shoulder_hip_angular_velocity_change_deg_s",
        "hip_deceleration_to_double_support_proxy_ms"
      ],
      "required_phase_keys": [
        "stable_control_onset_ms"
      ],
      "required_semantic_keys": [
        "stable_control_interval"
      ],
      "registry_indicator_sha256": "a2b3464bdd6d09bd4ba7ad3039e7dcea6317c1283edd385bf3fce12682df0346"
    }
  ]
}
